[
  {
    "id": "GS-X001",
    "version": 1,
    "title": "导流与站内承接",
    "scope": "xiaohongshu",
    "scenes": [
      "all"
    ],
    "status": "active",
    "evidence_type": "official",
    "source_ids": [
      "X01"
    ],
    "effective_from": null,
    "effective_to": null,
    "last_verified": "2026-09-06",
    "review_after": "2026-10-06",
    "check": "区分个人联系方式、其他平台入口与用户实际可用的官方挂载；REDSkill等官方组件须核发布入口、适用权限和内容一致性，不能一律按站外导流处理。",
    "exceptions": "按真实目的、场景、上下文、授权及来源核实，不因关键词单独定违规。",
    "action": "先定位原始证据，再核适用条款；无法确认时输出需复核。",
    "supersedes": null,
    "case_ids": []
  },
  {
    "id": "GS-X002",
    "version": 1,
    "title": "真实分享与商业合作",
    "scope": "xiaohongshu",
    "scenes": [
      "all"
    ],
    "status": "active",
    "evidence_type": "official",
    "source_ids": [
      "X01",
      "X03",
      "X04",
      "X05"
    ],
    "effective_from": null,
    "effective_to": null,
    "last_verified": "2026-09-06",
    "review_after": "2026-10-06",
    "check": "内容是否有真实体验、商家利益关系及夸张宣传；社区笔记与聚光广告分别适用，不把投放禁准入泛化到所有笔记。",
    "exceptions": "按真实目的、场景、上下文、授权及来源核实，不因关键词单独定违规。",
    "action": "先定位原始证据，再核适用条款；无法确认时输出需复核。",
    "supersedes": null,
    "case_ids": []
  },
  {
    "id": "GS-X003",
    "version": 1,
    "title": "交易导流专项",
    "scope": "xiaohongshu",
    "scenes": [
      "all"
    ],
    "status": "verification_needed",
    "evidence_type": "source_pending",
    "source_ids": [
      "X06"
    ],
    "effective_from": null,
    "effective_to": null,
    "last_verified": "2026-09-07",
    "review_after": "2026-09-14",
    "check": "涉及付款、私聊报价、外站领资源承接交易时补查交易导流细则。当前X06是媒体转述，未取得完整现行条文不得报成已核官方细则。",
    "exceptions": "按真实目的、场景、上下文、授权及来源核实，不因关键词单独定违规。",
    "action": "先定位原始证据，再核适用条款；无法确认时输出需复核。",
    "supersedes": null,
    "case_ids": []
  },
  {
    "id": "GS-X004",
    "version": 1,
    "title": "生成内容与挂载资料",
    "scope": "xiaohongshu",
    "scenes": [
      "all"
    ],
    "status": "active",
    "evidence_type": "official",
    "source_ids": [
      "X05",
      "L05"
    ],
    "effective_from": null,
    "effective_to": null,
    "last_verified": "2026-09-06",
    "review_after": "2026-10-06",
    "check": "核AI声明、引用与挂载资料的真实性、授权和可用性。社区公约2.0的X05只是转述，标识要求同时核L05及实际发布功能。",
    "exceptions": "按真实目的、场景、上下文、授权及来源核实，不因关键词单独定违规。",
    "action": "先定位原始证据，再核适用条款；无法确认时输出需复核。",
    "supersedes": null,
    "case_ids": []
  }
]
